{
  "id": "quiver-devkit-v0",
  "slug": "quiver-devkit",
  "name": "Quiver DevKit",
  "category": "aircraft-devkit",
  "status": "limited-availability",
  "lifecycleStage": "devkit",
  "shortDescription": "A developer-focused Quiver kit for builders who want to test, modify, and extend Arrow's open-source VTOL platform.",
  "included": [
    {
      "label": "Quiver airframe",
      "notes": "CNC 6061 aluminum plates, carbon fiber arms and landing gear, busbars, and PETG-CF enclosure — built and tested to the Quiver Manufacturing Guide."
    },
    {
      "label": "Propulsion set",
      "quantity": 4,
      "notes": "Hobbywing XRotor X6 Plus G2 motor/ESC/propeller sets, plus a spare propeller set (2 CW + 2 CCW)."
    },
    {
      "label": "Avionics suite",
      "notes": "Holybro Pix32 v6 flight controller, Raspberry Pi 5 (8 GB), H-RTK F9P and M9N GNSS, radar altimeter, SIYI A8 mini gimbal camera, SIYI HM30 FPV link, Remote ID module, and onboard Ethernet network."
    },
    {
      "label": "Arrow PCB set",
      "notes": "Assembled main, flight-controller, and battery-controller PCBs with full wiring harness."
    },
    {
      "label": "Arrow-sanctioned build standard",
      "notes": "Manufactured to the linked Quiver manufacturing guide and related standards."
    }
  ],
  "notIncluded": [
    {
      "label": "Payloads and optional sensors",
      "notes": "Obstacle-avoidance lidar, forward radar, and a transport case are planned as optional add-ons."
    }
  ],
  "requiredSeparately": [
    {
      "label": "Flight battery",
      "notes": "14S LiPo, e.g. Tattu 14S 30,000 mAh."
    },
    {
      "label": "Battery charger",
      "notes": "High-power 14S-capable charger, e.g. SKYRC PC3000H."
    },
    {
      "label": "RC transmitter and receiver",
      "notes": "e.g. RadioMaster Boxer with compatible receiver."
    }
  ],
  "standards": [
    {
      "id": "quiver-manufacturing-guide",
      "label": "Quiver Manufacturing Guide",
      "url": "https://www.arrowair.com/quiver/Manufacturing/Manufacturing-Guide",
      "kind": "manufacturing-guide",
      "required": true,
      "description": "Primary build standard for Arrow-sanctioned Quiver DevKits."
    }
  ],
  "supportPolicyId": "devkit-manufacturer-first-support",
  "warrantyPolicyId": "one-year-workmanship-devkit",
  "offers": [
    {
      "id": "quiver-devkit-thomas-texas",
      "manufacturerId": "thomas-texas",
      "checkoutGroupId": "thomas-store",
      "status": "limited-availability",
      "regionLabel": "United States",
      "shipsFrom": "Texas, USA",
      "shipsTo": [
        "US"
      ],
      "priceDisplay": "$4,900 USD",
      "price": {
        "amount": 490000,
        "currency": "USD"
      },
      "leadTimeDisplay": "Ships in 3 business days while stock lasts; built to order after that",
      "inventoryDisplay": "Limited MVP batch in stock",
      "paymentMethods": [
        "card",
        "usdc",
        "invoice"
      ],
      "checkout": {
        "mode": "manufacturer-site",
        "ctaLabel": "Buy from Javelina Propeller Laboratory",
        "immediatePayment": true,
        "customerNotice": "Pay by card or USDC: JPL sends a Stripe invoice with your order confirmation. A direct online payment link is coming soon."
      },
      "merchantOfRecordName": "Javelina Propeller Laboratory LLC",
      "daoFee": {
        "type": "percent-of-gross",
        "percent": 20,
        "includedInPrice": true,
        "remittance": "manual",
        "publicLabel": "Includes 20% Arrow DAO support & marketplace fee"
      },
      "aip009": {
        "catalogEntryId": "quiver-devkit-v0"
      },
      "notes": "Initial trusted MVP offer. DAO fee percentage is proposed via this catalog entry and subject to DAO approval; expected to decrease as the program matures."
    },
    {
      "id": "quiver-devkit-julius-germany",
      "manufacturerId": "julius-germany",
      "checkoutGroupId": "julius-store",
      "status": "waitlist",
      "regionLabel": "Europe",
      "shipsFrom": "Germany",
      "shipsTo": [
        "EU"
      ],
      "priceDisplay": "TBD",
      "leadTimeDisplay": "TBD",
      "inventoryDisplay": "TBD",
      "paymentMethods": [
        "card",
        "usdc",
        "invoice"
      ],
      "checkout": {
        "mode": "manufacturer-site",
        "ctaLabel": "Buy from Germany workshop",
        "immediatePayment": true,
        "customerNotice": "Checkout URL is TBD. Payment will be accepted by the manufacturer as merchant of record."
      },
      "merchantOfRecordName": "TBD",
      "daoFee": {
        "type": "tbd",
        "includedInPrice": true,
        "remittance": "tbd",
        "publicLabel": "Marketplace / standards coordination fee TBD"
      },
      "aip009": {
        "catalogEntryId": "quiver-devkit-v0"
      },
      "notes": "Placeholder EU offer for model validation; confirm scope with Julius before public launch."
    }
  ],
  "tags": [
    "quiver",
    "devkit",
    "aip-009"
  ],
  "updatedAt": "2026-06-11"
}
