{
  "id": "quiver-spare-propellers-v0",
  "slug": "quiver-spare-propellers",
  "name": "Quiver Spare Propeller (XRotor MFP 2480)",
  "category": "part",
  "status": "available",
  "lifecycleStage": "devkit",
  "shortDescription": "Genuine Hobbywing XRotor MFP 2480 replacement propeller for the Quiver DevKit, available in CW and CCW.",
  "included": [
    {
      "label": "Hobbywing XRotor MFP 2480 propeller",
      "quantity": 1,
      "notes": "Specify CW or CCW (and how many of each) in the order notes at checkout."
    }
  ],
  "notIncluded": [],
  "requiredSeparately": [],
  "standards": [
    {
      "id": "quiver-manufacturing-guide",
      "label": "Quiver Manufacturing Guide",
      "url": "https://www.arrowair.com/quiver/Manufacturing/Manufacturing-Guide",
      "kind": "manufacturing-guide",
      "required": true,
      "description": "Reference standard until a dedicated spare-parts standard exists."
    }
  ],
  "supportPolicyId": "devkit-manufacturer-first-support",
  "warrantyPolicyId": "one-year-workmanship-devkit",
  "offers": [
    {
      "id": "spare-propellers-thomas-texas",
      "manufacturerId": "thomas-texas",
      "checkoutGroupId": "thomas-store",
      "status": "available",
      "regionLabel": "United States",
      "shipsFrom": "Texas, USA",
      "shipsTo": [
        "US"
      ],
      "priceDisplay": "$19.99 USD each",
      "leadTimeDisplay": "Ships in 3 business days",
      "paymentMethods": [
        "card",
        "usdc",
        "invoice"
      ],
      "checkout": {
        "mode": "manufacturer-site",
        "ctaLabel": "Add from Javelina Propeller Laboratory",
        "immediatePayment": true,
        "customerNotice": "Matches Hobbywing retail pricing. Shares a checkout with the Quiver DevKit, so spares can ship in the same order."
      },
      "merchantOfRecordName": "Javelina Propeller Laboratory LLC",
      "notes": "Pass-through retail part sold at Hobbywing list price; no DAO fee is proposed on pass-through parts."
    }
  ],
  "tags": [
    "quiver",
    "spares",
    "propellers"
  ],
  "updatedAt": "2026-06-11"
}
